#Eco.,Descripción,Previsiones Iniciales,Total Modificaciones,Previsiones totales,Derechos Reconocidos Netos
11200,IMPUESTO SOBRE BIENES INMUEBLES.  NAT RUSTICA,70000,0,70000,46167.94
11300,IMPTO SOBRE BIENES INMUEBLES DE NAT URBANA,17779161.25,0,17779161.25,17925775.33
11500,IMPUESTO SOBRE VEHICULOS DE TRACCION MECANICA,3600000,0,3600000,3454231.94
11601,IMPUESTO SOBRE INCREM DEL VALOR DE LOS TERRN DE NAT URBANA,1000000,0,1000000,1960186.4
13001,IMPUESTO SOBRE ACTIVIDADES ECONOMICAS,2500000,0,2500000,2259907.61
30100,TASA POR DEPURACION DE AGUAS,358177.41,0,358177.41,-5150.44
30200,TASA SERVICIO INTEGRAL RESIDUOS Y P.VERDE,3550000,0,3550000,3357260.16
32300,INSPECCION TECNICA LICENCIA DE APERTURA,25000,0,25000,25950.41
32600,RETIRADA VEHICULOS VIA PUBLICA (GRUA),45065,0,45065,26470
33800,COMPENSACION DE TELEFONICA DE ESPAÑA S.A.,212000,0,212000,156005.21
39300,INTERESES DE DEMORA,250000,0,250000,453815.12
45000,DE LA ADMON. GENERAL DE LA COMUNIDAD DE MADRID,1118710,8495,1127205,956939.15
49000,DEL FONDO SOCIAL EUROPEO,125839,0,125839,16942.2
51800,INTERESES PRESTAMO PERSONAL,508.31,0,508.31,0
52000,INTERESES EN CTAS.BANCOS Y CAJAS DE AHORRO,8000,0,8000,2115.98
54100,ARRENDAMIENTOS DE FINCAS URBANAS,550000,0,550000,421392.44
54200,ARRENDAMIENTOS DE FINCAS RUSTICAS,10000,0,10000,0
55000,CONCESIONES ADMINISTRATIVAS,539031.66,0,539031.66,439954.62
60100,VENTA DE FINCAS RUSTICAS,0,0,0,0
60300,PATRIMONIO PUBLICO DEL SUELO,2616368.83,0,2616368.83,0
61900,ENAJENACIONES PLAZAS DE GARAJES MPLES,0,0,0,0
61901,ENAJENACIONES  DE VIVIENDAS Y LOCALES,0,0,0,0
77000,TRANSFERENCIA CAPITAL EMPRESAS  Y ENTIDADES  PRIVADAS,0,0,0,0
11600,INSPECCION PLUS VALIAS,55000,0,55000,389.3
13000,INSPECCION I.A.E.,350000,0,350000,271588.41
29000,IMPTO.S/CONSTRUCCIONES Y OBRAS,936896.12,0,936896.12,268702.91
29001,INSPECCION I.C.I.O.,107320.04,0,107320.04,10841.64
30500,SERVICIOS FUNERARIOS,0,0,0,8865
31100,TASA SERVICIO AMBULANCIA MUNICIPAL,30000,0,30000,31609.98
31108,SERVICIO DE AYUDA A DOMICILIO,41941.8,0,41941.8,15586.97
31301,TASA POR DERECHOS DE FUTBOL,45000,0,45000,17182.8
31304,INSTALACIONES DEPORTIVAS,251000,0,251000,161283.42
31407,TASA SERVICIO SANITARIO DE PERRERA MUNICIPAL,9500,0,9500,9488.18
32100,LICENCIAS URBANISTICAS,200000,0,200000,140175.95
32104,LICENCIA APERTURA ESTABLECIMIENTOS,300000,0,300000,304230.05
32105,"INSPECCION L.URB.,APERTURA Y OCUPACION",0,0,0,0
32106,TASA POR INSPECCION TECNICA DE DIFICIOS,28409.76,0,28409.76,2252.4
32200,LICENCIAS PRIMERA OCUPACION,30000,0,30000,17442.71
32500,EXPEDICION DE DOCUMENTOS,35000,0,35000,36029.25
32501,LICENCIAS AUTOTAXIS Y VEHICULOS ALQUILER,0,0,0,0
32502,TASA POR EXPEDICION Y RENOVACION TARJETAS TRANSPORTE,40000,0,40000,33709.2
32509,TASA POR DERECHOS DE EXAMEN,0,0,0,-40.18
32700,TASA PRE. SERVI. BODAS.,38000,0,38000,22810.26
32901,PLAC.PATEN.DISTIN.UTILIZ.ESCUDO ENTIDAD,5000,0,5000,2187.9
33001,APARCAMIENTO DE CAMIONES,80000,0,80000,75946.98
33002,PARKING MUNICIPAL,34847.31,0,34847.31,30913.35
33003,TASA POR ESTACIONAMIENTO ZONA SER,0,0,0,0
33101,ENTR.VEHIC.EN EDIF.Y RES.APAR.EXCLUSIVO,690000,0,690000,662186.1
33203,TASA EMPRESAS EXPLT. DE SUMINISTROS INTERES GENERAL,1000000,0,1000000,1029267.2
33300,TASA EMPRESAS EXPLT. DE SER. TELECOMUNICACIONES,29536.43,0,29536.43,0
33402,CALICATAS Y ZANJAS EN LA VIA PUBLICA.,29566.69,0,29566.69,4869.93
33500,"OCUPACION VIA PUBLICA CON MESAS,SILLAS ETC.",100000,0,100000,75768.39
33501,QUIOSCOS Y CRISTALES EN LA VIA PUBLICA,20000,0,20000,23997.41
33502,TASA POR BARRACAS Y PUESTOS FERIANTES,33000,0,33000,29306.85
33601,OCUPACION DE LA VIA PUBLICA CON MERCANCIA,7000,0,7000,7137.44
33602,TASA POR MERCADILLOS AMBULANTES,45000,0,45000,41462.48
33603,OCUPACION VIA PUBLICA CONTENEDORES,10000,0,10000,8187.09
33604,OTRAS OCUPACIONES,7000,0,7000,1858.5
33900,VALL.ANDA.ESC.OTR.MAT.CONST.EN VIA PUBLICA.,1000,0,1000,17331.89
33901,OCUPACION CEMENTERIO,0,0,0,15534.64
33904,TASA POR APROV.ESPECIAL CAJEROS AUTOMATICOS,10000,0,10000,7259.85
33905,TASA POR OTRAS OCUPACIONES,16000,0,16000,17994.92
34201,ESCUELA DE MUSICA,400000,0,400000,335981.62
34202,CURSOS Y ACTIVIDADES EDUCACION,115287.68,0,115287.68,25.5
34300,CURSOS Y ACTIVIDADES DEPORTIVAS,400000,0,400000,252666.15
34404,FESTEJOS TAURINOS,90000,0,90000,0
34600,ACTIVIDADES CULTURALES,50300,0,50300,33572.88
34707,CURSOS Y ACTIVIDADES PARTICIPACION CIUDADANA,291561,0,291561,214327.83
34808,CURSOS Y ACTIVIDADES JUVENTUD,6404.73,0,6404.73,933.93
34900,OTROS CURSOS Y ACTIVIDADES,2693.9,0,2693.9,0
34901,PRECIOS PUBLICOS BOLETIN MUNICIPAL,40000,0,40000,37486.74
34902,OTROS PRECIOS PUBLICOS,280,0,280,602
36000,VENTA DE MONOMATERIALES,296288.92,0,296288.92,236372.94
36001,VENTA DE IMPRESOS,0,0,0,0
36002,VENTA MATERIAL DE DESECHOS,6770,0,6770,5880
36003,VENTA DE ENERGIA,4195.08,0,4195.08,840.14
38000,REINTEGROS DE AVALES,0,0,0,0
38900,REINTEGROS PRESUPUESTOS CERRADOS,28000,0,28000,106968.55
39000,OTROS INGRESOS,117314.78,0,117314.78,69434.67
39110,SANCIONES TRIBUTARIAS,71360,0,71360,29020.09
39120,MULTAS DE TRAFICO,721976.75,0,721976.75,44482.94
39121,MULTAS S.E.R.,150000,0,150000,264382.88
39190,MULTAS DE CONVIVENCIA CIUDADANA,200000,0,200000,90654.2
39191,OTRAS MULTAS Y SANCIONES,0,0,0,0
39200,RECARGO POR DECLARACIÓN EXTEMPORÁNEA SIN REQ.PREVIO,5885.67,0,5885.67,2447.01
39210,RECARGO EJECUTIVO,15449.49,0,15449.49,57252.61
39211,RECARGOS DE APREMIOS,550000,0,550000,435117.82
39710,OTROS INGRESOS POR MONETARIZACIONES URBANISTICAS,0,0,0,102955
39800,INDEMNIZACIONES SEGUROS,18945.07,16366.83,35311.9,21190.68
39801,INDEMNIZACIONES JUZGADOS,2205.27,0,2205.27,2478.18
39902,COMUNIDAD AGUA Y OTROS PISOS ALQUILER,21470.7,0,21470.7,11772.53
39903,ANUNCIOS A CARGO DE PARTICULARES,65380.58,0,65380.58,23414.67
39904,IMPORTE OBRAS E INST.A C/PARTICULARES,60000,0,60000,32143.35
39906,INDETERMINADOS,10000,0,10000,0
39907,IMPREVISTOS,21336.92,0,21336.92,32136.14
39908,APROVECHAMIENTOS URBANISTICOS,0,0,0,0
39912,CUOTAS MANTENIMIENTO ESCUELAS INFANTILES,116737.15,0,116737.15,35154.58
39916,INGRESOS PROCEDENTES COLABORACION ALUMNOS EN PRACTICAS,13233.6,0,13233.6,8623.2
42000,PARTICIPACION EN TRIBUTOS DEL ESTADO,19915324.5,0,19915324.5,14764572.91
42001,DE LA ADMINISTRACION GENERAL DEL ESTADO,6320,0,6320,0
42090,OTRAS TRANSFERENCIAS CORRIENTES,714.34,0,714.34,793.69
42190,IMSERSO,0,0,0,0
42390,TRANSF. DE SOCIEDADES MERCANTILES ESTATALES Y PUBLICAS,0,0,0,0
45002,TRANS.CTES.CUMPLIMIENTO DE CONV.SERV.SOC.Y POL.DE IGUALDAD,3409309.68,9889.43,3419199.11,3327252.72
45030,TRANS.CTES.CUMPLIMIENTO DE CONV.EN MATERIA DE EDUCACION,560000,0,560000,388798.84
45050,DEL INEM (DE LA COMUNIDAD DE MADRID),62287.2,405872.7,468159.9,107711.21
45060,TRANSFE. CORRIEN. PRISMA,2230936.75,0,2230936.75,2230937
45100,CONSORCIO REGIONAL DE TRANSPORTES,0,0,0,0
46100,TRANSFERENCIA DE AYTOS,0,0,0,0
47000,DE EMPRESAS PRIVADAS,3299364,957.43,3300321.43,958
53400,DE SOC. Y ENTIDADES DEPENDIENTES DE LAS ENTIDADES LOCALES,313665.16,0,313665.16,419973.72
53410,DE SOC. Y ESTIDADES NO DEPENDIENTES DE LAS ENTIDADES LOCALES,0,0,0,0
55400,PRODUCTOS DE EXPLOTACIONES FORESTALES,0,0,0,0
55410,FONDO DE MEJORA DE MONTES,0,0,0,0
60900,OTROS TERRENOS,0,0,0,0
87000,APLICACION PARA FINANCIACION DE INCORPORACIONES DE CREDITO,0,0,0,0
87010,APLICACION PARA FINANCIACION DE INCORPORACIONES DE CREDITO,0,323284.42,323284.42,0
91301,A MEDIO Y LARGO PLAZO,0,0,0,0
